{
  "$schema": "http://json-schema.org/draft-07/schema#",
  "$id": "https://orchestra.workflow/schemas/resources.schema.json",
  "title": "OrchestraResourceRegistry",
  "description": "Canonical machine-readable registry of verified Orchestra resources, tools, libraries, standards, and references",
  "type": "array",
  "items": {
    "type": "object",
    "required": [
      "id",
      "name",
      "canonical_url",
      "source_type",
      "category",
      "representation",
      "routing_tags",
      "acquisition_method",
      "runtime_method",
      "status",
      "trigger_conditions",
      "skip_conditions"
    ],
    "properties": {
      "id": {
        "type": "string",
        "pattern": "^[a-z0-9-]+$",
        "description": "Unique kebab-case identifier for the resource"
      },
      "name": {
        "type": "string",
        "description": "Human-readable display name"
      },
      "canonical_url": {
        "type": "string",
        "format": "uri",
        "description": "Direct official website, documentation, or portal URL"
      },
      "source_type": {
        "type": "string",
        "enum": [
          "github_repository",
          "web_reference",
          "npm_package",
          "pypi_package",
          "cli_tool",
          "mcp_server",
          "standard_specification",
          "specification",
          "agent_skill",
          "desktop_application",
          "local_runtime",
          "digital_archive",
          "component_gallery",
          "asset_archive"
        ],
        "description": "Origin type of the resource"
      },
      "source_repository": {
        "type": "string",
        "format": "uri",
        "description": "Git clone URL or GitHub repository link"
      },
      "documentation_url": {
        "type": "string",
        "format": "uri",
        "description": "Direct link to official API / SDK documentation"
      },
      "license": {
        "type": "string",
        "description": "Open source or proprietary license identifier"
      },
      "category": {
        "type": "array",
        "items": {
          "type": "string"
        },
        "description": "Functional domain classifications"
      },
      "representation": {
        "type": "string",
        "enum": [
          "dependency",
          "research_source",
          "cli",
          "mcp",
          "skill",
          "standard",
          "desktop_app",
          "service",
          "code_repo",
          "profile",
          "reference",
          "infrastructure",
          "dev_utility",
          "prompt_library",
          "plugin",
          "executor",
          "quarantined_reference",
          "project_tool",
          "resource"
        ],
        "description": "How the runtime represents this resource"
      },
      "routing_tags": {
        "type": "array",
        "items": {
          "type": "string"
        },
        "description": "Capability matching keywords used by router"
      },
      "acquisition_method": {
        "type": "string",
        "enum": [
          "npm",
          "git",
          "pip",
          "npx",
          "web_fetch",
          "mcp_install",
          "host_mcp_connect",
          "manual",
          "none",
          "git_clone"
        ],
        "description": "Engine acquisition mechanism"
      },
      "runtime_method": {
        "type": "string",
        "enum": [
          "project_scoped_install",
          "on_demand_research",
          "on_demand_cli",
          "global_active_skill",
          "curated_catalog_lazy_load",
          "mcp_connection",
          "reference_only",
          "local_daemon",
          "desktop_exec"
        ],
        "description": "Activation lifecycle in the execution environment"
      },
      "status": {
        "type": "string",
        "enum": [
          "ACTIVE",
          "CURATED_OPTIONAL",
          "REJECTED",
          "BOOKMARK",
          "DEFERRED",
          "CORE",
          "REFERENCE",
          "ARCHIVED",
          "LEFTOVER",
          "PURCHASE_PENDING",
          "PROJECT_ONLY",
          "CATALOG",
          "EXPERIMENTAL",
          "PRIVILEGED",
          "AUTH_REQUIRED",
          "OBSOLETE"
        ],
        "description": "Curation status per Orchestra policy"
      },
      "trigger_conditions": {
        "type": "array",
        "items": {
          "type": "string"
        },
        "description": "Explicit task requirements that trigger this resource",
        "minItems": 1
      },
      "avoid_conditions": {
        "type": "array",
        "items": {
          "type": "string"
        },
        "description": "Scenarios where resource invocation is forbidden"
      },
      "skip_conditions": {
        "type": "array",
        "items": {
          "type": "string"
        },
        "description": "Plain-language reasons to decline this resource on a job",
        "minItems": 1
      },
      "policy_verdict": {
        "type": "string",
        "description": "Authoritative policy verdict from STACK.md"
      },
      "rationale": {
        "type": "string",
        "description": "Contextual reason for verdict or operational usage constraints"
      },
      "token_context_weight": {
        "type": "number",
        "description": "Estimated token context weight when activated"
      },
      "npm_package": {
        "type": "string",
        "description": "Exact npm specifier when it differs from the resource id (e.g. @react-three/drei)"
      },
      "problem_solved": {
        "type": "string",
        "description": "One-line job this resource is for"
      },
      "upstream_version": {
        "type": "string",
        "description": "Upstream tag or channel (may differ from the installed variant)"
      },
      "installed_variant": {
        "type": "string",
        "description": "What is actually on disk if it is not the upstream default"
      },
      "preferred_harness": {
        "type": "array",
        "items": {
          "type": "string"
        },
        "description": "Hosts or CLIs that should run this resource first"
      },
      "fallback": {
        "type": "string",
        "description": "What to try if this resource is unavailable"
      },
      "last_verified": {
        "type": "string",
        "description": "ISO date the row was last checked against a real job or live docs"
      },
      "auth": {
        "type": "string",
        "enum": [
          "NONE",
          "HOST_CONNECT",
          "AUTH_REQUIRED",
          "PURCHASE_PENDING"
        ],
        "description": "Authentication boundary. Unauthorized is not HEALTHY."
      },
      "free_capability": {
        "type": "string",
        "description": "What is legally usable without purchase"
      },
      "paid_capability": {
        "type": "string",
        "description": "What remains paid or Pro-gated"
      }
    },
    "additionalProperties": false
  }
}
