[
  {
    "id": "screenshot-to-code",
    "name": "Screenshot to Code",
    "canonical_url": "https://github.com/abi/screenshot-to-code",
    "source_type": "github_repository",
    "source_repository": "https://github.com/abi/screenshot-to-code.git",
    "documentation_url": "https://github.com/abi/screenshot-to-code/blob/main/README.md",
    "license": "MIT",
    "category": [
      "ai",
      "vision",
      "code_generation"
    ],
    "representation": "cli",
    "routing_tags": [
      "screenshot-to-code",
      "reverse-engineering",
      "vision-to-code"
    ],
    "acquisition_method": "git",
    "runtime_method": "on_demand_cli",
    "status": "CURATED_OPTIONAL",
    "trigger_conditions": [
      "human attached a screenshot or mock and asked to recreate layout",
      "screenshot-to-code",
      "screenshot to reference"
    ],
    "avoid_conditions": [
      "cloning logos trademarks or their source",
      "LinkedIn or Instagram scrape",
      "skills add --all"
    ],
    "policy_verdict": "CURATED OPTIONAL",
    "rationale": "On-demand when a screenshot is the reference. Extract layout/type into DESIGN.md, then implement original. Not always-on.",
    "skip_conditions": [
      "cloning logos trademarks or their source",
      "LinkedIn or Instagram scrape",
      "skills add --all"
    ]
  },
  {
    "id": "addyosmani-agent-skills",
    "name": "Addy Osmani Agent Skills",
    "canonical_url": "https://github.com/addyosmani/agent-skills",
    "source_type": "github_repository",
    "source_repository": "https://github.com/addyosmani/agent-skills.git",
    "documentation_url": "https://github.com/addyosmani/agent-skills/blob/main/README.md",
    "license": "MIT",
    "category": [
      "agent_skills",
      "skill_pack"
    ],
    "representation": "skill",
    "routing_tags": [
      "skill-dump",
      "anti-pattern",
      "bulk-skills"
    ],
    "acquisition_method": "none",
    "runtime_method": "reference_only",
    "status": "REJECTED",
    "trigger_conditions": [
      "human asked to dump-install this refused resource"
    ],
    "avoid_conditions": [
      "npx skills add",
      "bulk skill imports"
    ],
    "policy_verdict": "REJECTED",
    "rationale": "Skill dump. Already on Hated. Never 'npx skills add'. Quarantined to prevent context bloat.",
    "skip_conditions": [
      "never load into runtime; quarantined or refused"
    ]
  },
  {
    "id": "affaan-ecc",
    "name": "ECC (Efficient Context Control)",
    "canonical_url": "https://github.com/affaan-m/ECC",
    "source_type": "github_repository",
    "source_repository": "https://github.com/affaan-m/ECC.git",
    "documentation_url": "https://github.com/affaan-m/ECC/blob/main/README.md",
    "license": "MIT",
    "category": [
      "workflow",
      "architecture",
      "context_management"
    ],
    "representation": "reference",
    "routing_tags": [
      "method-only",
      "isolation",
      "planning",
      "subagent-specialization"
    ],
    "acquisition_method": "none",
    "runtime_method": "reference_only",
    "status": "REJECTED",
    "trigger_conditions": [
      "complex multi-stage task planning",
      "context isolation design"
    ],
    "avoid_conditions": [
      "direct installation of 68 agents / 286 skills into runtime"
    ],
    "policy_verdict": "REJECTED (STEAL-THIN)",
    "rationale": "Load-by-job + isolate plan/implement/review. Do not install 68 agents / 286 skills into Cursor or Antigravity. Steal the methodology only.",
    "skip_conditions": [
      "never load into runtime; quarantined or refused"
    ]
  },
  {
    "id": "anthropics-skills",
    "name": "Anthropic Skills Marketplace",
    "canonical_url": "https://github.com/anthropics/skills",
    "source_type": "github_repository",
    "source_repository": "https://github.com/anthropics/skills.git",
    "documentation_url": "https://github.com/anthropics/skills/blob/main/README.md",
    "license": "MIT",
    "category": [
      "agent_skills",
      "marketplace"
    ],
    "representation": "skill",
    "routing_tags": [
      "skill-dump",
      "marketplace",
      "claude-skills"
    ],
    "acquisition_method": "none",
    "runtime_method": "reference_only",
    "status": "REJECTED",
    "trigger_conditions": [
      "human asked to dump-install this refused resource"
    ],
    "avoid_conditions": [
      "plugin marketplace add"
    ],
    "policy_verdict": "REJECTED",
    "rationale": "Marketplace dump. Orchestra-docs already covers PPTX/PDF. Do not '/plugin marketplace add'.",
    "skip_conditions": [
      "never load into runtime; quarantined or refused"
    ]
  },
  {
    "id": "browser-use",
    "name": "Browser Use",
    "canonical_url": "https://github.com/browser-use/browser-use",
    "source_type": "github_repository",
    "source_repository": "https://github.com/browser-use/browser-use.git",
    "documentation_url": "https://docs.browser-use.com",
    "license": "MIT",
    "category": [
      "browser_automation",
      "agent_tool"
    ],
    "representation": "service",
    "routing_tags": [
      "web-automation",
      "redundant-playwright",
      "agent-scraping"
    ],
    "acquisition_method": "none",
    "runtime_method": "reference_only",
    "status": "REJECTED",
    "trigger_conditions": [
      "human asked to dump-install this refused resource"
    ],
    "avoid_conditions": [
      "browser automation on our apps"
    ],
    "policy_verdict": "REJECTED",
    "rationale": "Agent web automation platform. Redundant because Playwright already verifies our UI.",
    "skip_conditions": [
      "never load into runtime; quarantined or refused"
    ]
  },
  {
    "id": "pretext",
    "name": "Pretext",
    "canonical_url": "https://github.com/chenglou/pretext",
    "source_type": "github_repository",
    "source_repository": "https://github.com/chenglou/pretext.git",
    "documentation_url": "https://github.com/chenglou/pretext/blob/main/README.md",
    "license": "MIT",
    "category": [
      "layout_engine",
      "text_measurement",
      "canvas"
    ],
    "representation": "dependency",
    "routing_tags": [
      "text-layout",
      "canvas",
      "no-reflow",
      "performance-typography"
    ],
    "acquisition_method": "npm",
    "runtime_method": "project_scoped_install",
    "status": "BOOKMARK",
    "trigger_conditions": [
      "dense HUD text layout",
      "high-frequency DOM layout reflow bottleneck"
    ],
    "avoid_conditions": [
      "standard static web layout"
    ],
    "policy_verdict": "BOOKMARK",
    "rationale": "Real text-layout lib (no DOM reflow). Fable HUD Plan may npm install if labels wrap badly. Keep on-demand.",
    "skip_conditions": [
      "standard static web layout"
    ]
  },
  {
    "id": "build-your-own-x",
    "name": "Build Your Own X",
    "canonical_url": "https://github.com/codecrafters-io/build-your-own-x",
    "source_type": "github_repository",
    "source_repository": "https://github.com/codecrafters-io/build-your-own-x.git",
    "documentation_url": "https://github.com/codecrafters-io/build-your-own-x/blob/master/README.md",
    "license": "CC0-1.0",
    "category": [
      "education",
      "systems_programming",
      "curriculum"
    ],
    "representation": "reference",
    "routing_tags": [
      "curriculum",
      "systems-programming",
      "step-by-step-guide"
    ],
    "acquisition_method": "none",
    "runtime_method": "reference_only",
    "status": "BOOKMARK",
    "trigger_conditions": [
      "systems building reference",
      "learning protocol"
    ],
    "avoid_conditions": [
      "cloning entire monorepo",
      "installing as runtime skill"
    ],
    "policy_verdict": "BOOKMARK (HIGH)",
    "rationale": "Learning curriculum. Bookmark only; not a runtime skill. Do not clone the monorepo.",
    "skip_conditions": [
      "cloning entire monorepo",
      "installing as runtime skill"
    ]
  },
  {
    "id": "awesome-claude-skills",
    "name": "Awesome Claude Skills",
    "canonical_url": "https://github.com/ComposioHQ/awesome-claude-skills",
    "source_type": "github_repository",
    "source_repository": "https://github.com/ComposioHQ/awesome-claude-skills.git",
    "documentation_url": "https://github.com/ComposioHQ/awesome-claude-skills/blob/master/README.md",
    "license": "MIT",
    "category": [
      "skill_directory",
      "catalog"
    ],
    "representation": "reference",
    "routing_tags": [
      "skill-dump",
      "catalog",
      "unvetted-skills"
    ],
    "acquisition_method": "none",
    "runtime_method": "reference_only",
    "status": "REJECTED",
    "trigger_conditions": [
      "human asked to dump-install this refused resource"
    ],
    "avoid_conditions": [
      "importing bulk claude skills"
    ],
    "policy_verdict": "REJECTED",
    "rationale": "Skill dump directory. Violates quarantine boundary and curated skill governance.",
    "skip_conditions": [
      "never load into runtime; quarantined or refused"
    ]
  },
  {
    "id": "lenis",
    "name": "Lenis Smooth Scroll",
    "canonical_url": "https://lenis.darkroom.engineering/",
    "source_type": "github_repository",
    "source_repository": "https://github.com/darkroomengineering/lenis.git",
    "documentation_url": "https://github.com/darkroomengineering/lenis/blob/main/README.md",
    "license": "MIT",
    "category": [
      "motion",
      "frontend",
      "scroll"
    ],
    "representation": "dependency",
    "routing_tags": [
      "smooth-scroll",
      "parallax",
      "scroll-story"
    ],
    "acquisition_method": "npm",
    "runtime_method": "project_scoped_install",
    "status": "ACTIVE",
    "trigger_conditions": [
      "premium scroll experience",
      "custom scroll hijacking",
      "editorial scroll"
    ],
    "avoid_conditions": [
      "basic content sites",
      "conflicting with heavy WebGL camera controls"
    ],
    "policy_verdict": "SPECIALIST",